{
  "transcript": "Ravi Patel: Alright, let's get into the APAC expansion proposal. We've been circling this for two quarters and leadership wants a decision by end of month. Kenji, can you walk us through the go-to-market plan?\n\nKenji Tanaka: Sure. The proposal is to launch in Japan and Singapore first, using our existing SaaS platform with localization. We'd partner with Nomura Digital for distribution in Japan and go direct in Singapore. Target is GA by Q4 this year.\n\nSophie Laurent: Q4 is ambitious. Have we validated that our platform can handle multi-currency billing? Last I checked, the payments team said that's a six-month project minimum.\n\nKenji Tanaka: We've had preliminary conversations with the payments team. They think they can do a lightweight multi-currency layer in three months if we limit to USD, JPY, and SGD only. Full multi-currency would be Q2 next year.\n\nRavi Patel: Three months for the lightweight version — that puts us at July for payments readiness. That's tight for Q4 GA. What's the risk if payments slips?\n\nKenji Tanaka: If payments slips, we'd have to launch with USD-only billing and do manual currency conversion for Japan clients. Not ideal, but workable for the first 10-20 customers.\n\nSophie Laurent: Manual currency conversion is a compliance nightmare. Japan has strict invoicing requirements under the Qualified Invoice System. If we get that wrong, our Japanese clients can't claim tax credits on our invoices. That's a deal-breaker for enterprise buyers.\n\nRavi Patel: That's a real concern. Kenji, did the legal team review the invoicing requirements?\n\nKenji Tanaka: Not yet. We've been focused on the commercial side. Legal review is on the roadmap but hasn't started.\n\nDiana Osei: I want to flag the infrastructure question. Our current platform runs on US-East and EU-West. For Japan, we'd need an APAC region for latency requirements. The infra team estimates 8-10 weeks to stand up a new region, and that doesn't include security certification for the Japanese market.\n\nRavi Patel: What security certifications are we talking about?\n\nDiana Osei: At minimum, ISMAP certification for selling to Japanese government and large enterprise. That's a 4-6 month process. If we skip it, we're limited to SMB customers only.\n\nSophie Laurent: SMB-only in Japan is a tough market. The enterprise segment is where the revenue is. If we can't sell to enterprise, the unit economics don't work at the volumes Kenji is projecting.\n\nKenji Tanaka: The revenue model assumes 30% enterprise mix by month six. If we're SMB-only, we'd need to roughly double the customer count to hit the same revenue target.\n\nRavi Patel: That changes the math significantly. What about Singapore? Same infrastructure issues?\n\nDiana Osei: Singapore is easier — we can serve from our existing infrastructure with acceptable latency. No special certifications required beyond standard SOC 2, which we already have.\n\nKenji Tanaka: That's why I'd argue we should lead with Singapore and fast-follow with Japan once infrastructure and certifications are in place.\n\nSophie Laurent: I agree Singapore first makes sense. But we need to be honest with leadership that Japan isn't a Q4 play. It's more like Q2 next year if we're doing it right.\n\nRavi Patel: Let's not commit to a Japan timeline today. Kenji, can you put together a revised plan with Singapore as the lead market and Japan as a phased follow-on? I want to see the revised unit economics for Singapore standalone.\n\nKenji Tanaka: I can have a draft by next Friday.\n\nRavi Patel: Good. Diana, can you get a firm estimate from infra on the APAC region buildout and ISMAP certification timeline?\n\nDiana Osei: I'll have the infra estimate by Wednesday. ISMAP timeline I'll need to check with the compliance team — probably by end of next week.\n\nSophie Laurent: One more thing — the Nomura partnership. We've been in discussions but nothing is signed. If we shift to Singapore-first, do we still need Nomura for the initial launch?\n\nKenji Tanaka: Not for Singapore. Nomura is Japan-specific. But I wouldn't want to lose momentum on that relationship. I'd suggest we keep the conversation warm and formalize when we have a Japan launch date.\n\nRavi Patel: Agreed. Let's reconvene in two weeks with the revised plan, infra estimates, and a legal review status update.",
  "meeting_title": "APAC Expansion Planning — Week 12",
  "meeting_datetime": "2026-03-10T14:00:00-07:00",
  "team_context": "Series B SaaS company, 120 employees. Engineering is 60 people across Platform, Payments, and Infra teams. Currently serves US and EU markets only. Board is pushing for APAC expansion as a growth lever for Series C positioning.",
  "focus_area": "launch readiness",
  "urgency_level": "high",
  "analysis_depth": "deep",
  "participant_directory": [
    {
      "name": "Ravi Patel",
      "role": "VP of Strategy",
      "team": "Strategy"
    },
    {
      "name": "Kenji Tanaka",
      "role": "Head of APAC GTM",
      "team": "Sales"
    },
    {
      "name": "Sophie Laurent",
      "role": "CFO",
      "team": "Finance"
    },
    {
      "name": "Diana Osei",
      "role": "VP of Engineering",
      "team": "Engineering"
    }
  ],
  "key_questions": [
    "Is the Q4 launch timeline realistic given infrastructure and payments dependencies?",
    "Who owns the legal review for Japanese invoicing compliance?",
    "What is the fallback if ISMAP certification takes longer than 6 months?",
    "Can Singapore standalone unit economics justify the expansion without Japan?"
  ]
}
